{
  "id": "motorcycle-4t",
  "extends": [
    "_base/motorcycle-common.json"
  ],
  "meta": {
    "make": "_base",
    "model": "Motorcycle 4-Stroke",
    "author": "abrahdev",
    "version": "1.0.0"
  },
  "maintenance_items": [
    {
      "id": "engine-oil-filter",
      "label": "Engine oil and filter",
      "i18n_key": "seed_interval_engine_oil_filter",
      "desc_i18n_key": "seed_desc_oil_change",
      "interval_km": 10000,
      "interval_months": 12,
      "description": "Drain old oil, replace oil filter element. Crucial for lubricating engine, transmission, and wet clutch."
    },
    {
      "id": "valve-adjustment",
      "label": "Valve adjustment",
      "i18n_key": "seed_interval_valve_adjustment",
      "desc_i18n_key": "seed_desc_valve_adjustment",
      "interval_km": 24000,
      "description": "Valve adjustment maintains proper compression and prevents premature wear on the cylinder head."
    },
    {
      "id": "air-filter",
      "label": "Air filter",
      "i18n_key": "seed_interval_air_filter",
      "desc_i18n_key": "seed_desc_air_filter",
      "interval_km": 10000,
      "description": "A dirty air filter reduces power, increases consumption, and can damage intake sensors."
    },
    {
      "id": "spark-plugs",
      "label": "Spark plugs",
      "i18n_key": "seed_interval_spark_plugs",
      "desc_i18n_key": "seed_desc_spark_plugs",
      "interval_km": 24000,
      "description": "Worn spark plugs increase consumption, make starting difficult, and can damage the ignition coil."
    },
    {
      "id": "coolant",
      "label": "Coolant",
      "i18n_key": "seed_interval_coolant",
      "desc_i18n_key": "seed_desc_coolant",
      "interval_km": 20000,
      "interval_months": 24,
      "description": "Coolant loses its antifreeze and anticorrosive properties over time, potentially damaging the engine's internal circuit."
    },
    {
      "id": "timing-chain",
      "label": "Timing chain",
      "interval_km": 40000,
      "description": "Check automatic tensioner wear indicator and chain slack. Replace if stretched to avoid catastrophic failure."
    }
  ]
}
