{
  "id": "toyota-corolla",
  "extends": [
    "_base/combustion.json"
  ],
  "meta": {
    "make": "Toyota",
    "model": "Corolla",
    "generation": "All",
    "author": "abrahdev",
    "version": "1.0.0"
  },
  "maintenance_items": [
    {
      "id": "oil-change",
      "interval_km": 15000,
      "interval_months": 12,
      "description": "Toyota recommends 0W20 synthetic with 15k km intervals for most Corolla generations."
    },
    {
      "id": "timing-belt",
      "remove": true,
      "description": "Corolla engines (2ZR, 1ZZ, 2ZZ) use timing chains, not belts."
    },
    {
      "id": "spark-plugs",
      "interval_km": 100000,
      "description": "Iridium spark plugs last up to 100k km on most Corolla generations."
    }
  ]
}
