{
  "id": "honda-hr-v",
  "extends": [
    "_base/car-combustion.json",
    "honda/dtc.json"
  ],
  "meta": {
    "make": "Honda",
    "model": "HR-V",
    "generation": "All",
    "author": "abrahdev",
    "version": "1.0.0"
  },
  "maintenance_items": [
    {
      "id": "timing-belt",
      "remove": true,
      "description": "Honda HR-V uses timing chain (L15 engine)."
    }
  ]
}
