{
  "id": "kia-rio",
  "extends": [
    "_base/combustion.json",
    "kia/dtc.json"
  ],
  "meta": {
    "make": "Kia",
    "model": "Rio",
    "generation": "All",
    "author": "abrahdev",
    "version": "1.0.0"
  },
  "maintenance_items": [
    {
      "id": "timing-belt",
      "remove": true,
      "description": "Kia Rio (Gamma engine) uses a timing chain."
    }
  ]
}
