{
  "id": "nissan-kicks",
  "extends": [
    "_base/combustion.json"
  ],
  "meta": {
    "make": "Nissan",
    "model": "Kicks",
    "generation": "All",
    "author": "abrahdev",
    "version": "1.0.0"
  },
  "maintenance_items": [
    {
      "id": "timing-belt",
      "remove": true,
      "description": "Nissan Kicks (HR16DE engine) uses a timing chain."
    }
  ]
}
