{
  "id": "hyundai-elantra",
  "extends": [
    "_base/car-combustion.json"
  ],
  "meta": {
    "make": "Hyundai",
    "model": "Elantra",
    "generation": "All",
    "author": "abrahdev",
    "version": "1.0.0"
  },
  "maintenance_items": [
    {
      "id": "timing-belt",
      "remove": true,
      "description": "Hyundai Elantra uses timing chains (Gamma, Kappa, Smartstream engines)."
    }
  ]
}
