{
  "id": "hyundai-tucson",
  "extends": [
    "_base/combustion.json"
  ],
  "meta": {
    "make": "Hyundai",
    "model": "Tucson",
    "generation": "All",
    "author": "abrahdev",
    "version": "1.0.0"
  },
  "maintenance_items": [
    {
      "id": "timing-belt",
      "remove": true,
      "description": "Hyundai Tucson uses timing chains (Theta, Gamma, Smartstream engines)."
    }
  ]
}
