{
  "id": "volvo-s60",
  "extends": [
    "_base/car-combustion.json"
  ],
  "meta": {
    "make": "Volvo",
    "model": "S60",
    "generation": "All",
    "author": "abrahdev",
    "version": "1.0.0"
  },
  "maintenance_items": [
    {
      "id": "timing-belt",
      "remove": true,
      "description": "Volvo S60 (Drive-E engines) uses a timing chain."
    }
  ]
}
