{
  "id": "honda-cr-v",
  "extends": [
    "_base/car-combustion.json",
    "honda/dtc.json"
  ],
  "meta": {
    "make": "Honda",
    "model": "CR-V",
    "generation": "All",
    "author": "abrahdev",
    "version": "1.0.0"
  },
  "maintenance_items": [
    {
      "id": "timing-belt",
      "remove": true,
      "description": "Honda CR-V uses timing chain (K24, L15 engines)."
    }
  ]
}
