{
  "id": "suzuki-swift",
  "extends": [
    "_base/combustion.json",
    "suzuki/dtc.json"
  ],
  "meta": {
    "make": "Suzuki",
    "model": "Swift",
    "generation": "All",
    "author": "abrahdev",
    "version": "1.0.0"
  },
  "maintenance_items": [
    {
      "id": "timing-belt",
      "remove": true,
      "description": "Suzuki Swift (K-series engine) uses a timing chain."
    }
  ]
}
