{
  "id": "ford-fiesta",
  "extends": [
    "_base/combustion.json",
    "ford/dtc.json"
  ],
  "meta": {
    "make": "Ford",
    "model": "Fiesta",
    "generation": "All",
    "author": "abrahdev",
    "version": "1.0.0"
  },
  "maintenance_items": [
    {
      "id": "timing-belt",
      "interval_km": 160000,
      "interval_months": 60,
      "description": "Ford specifies timing belt replacement. Replace water pump simultaneously."
    }
  ]
}
