{
  "id": "subaru-forester",
  "extends": [
    "_base/car-combustion.json",
    "subaru/dtc.json"
  ],
  "meta": {
    "make": "Subaru",
    "model": "Forester",
    "generation": "All",
    "author": "abrahdev",
    "version": "1.0.0"
  },
  "maintenance_items": [
    {
      "id": "timing-belt",
      "remove": true,
      "description": "Subaru Forester (FB, EJ engines) uses timing chains since ~2010."
    }
  ]
}
